{"action_id":"HK_STAGING_CANARY","authority":"GO-COMMAND-CENTER","environment":"HK-STAGING-01","expires_at":"2026-09-17T15:40:44.259628Z","issued_at":"2026-09-17T15:25:44.259628Z","nonce":"MNrNl3kvVgSOyC4hIcSE2vbNL9PCvV12","parameters":{"candidate_contract_sha256":"23d78ea846b21ace5318335eacb2a75826db5ff56cd925c8f8c58f6a83babed6","candidate_image_id":"sha256:8f8beb568209393fd74660c226ca7b14b2efe171caf5521645ec6fe4cea56119","candidate_package_sha256":"93f6812337e491d9144d6fb44a52764e9fa82313d2bb08a6373a613e4cdf30bf","expected_current_image_id":"sha256:6b92050ed42c115d29d2ff0b540c711b21747c7ed961384629a35571cf6b93a7","release_id":"boss-request-canary-20260917T152544Z-ee1e560dea0a"},"schema_version":"1","signature":"60d2c278d7587cbc0e4d9545058378cbf2da424d791e86fabdda185982be1c093a7f33ec51048c90a15e94dbe61e25f7b72cff39cde3a09c1c84c37aa938fa01","task_id":"go-boss-request-canary-20260917T152544Z-ee1e560dea0a"}
