{"action_id":"HK_STAGING_TEST_PR","authority":"GO-COMMAND-CENTER","environment":"HK-STAGING-01","expires_at":"2026-09-17T09:13:50.199118Z","issued_at":"2026-09-17T08:53:50.199118Z","nonce":"q_GbwEzcXShL-6lvDI6BnZ3i3jj5oXhz","parameters":{"builder_profile":"go-application-python-v1","source":{"commit_sha":"edd3500575d2f2b81298cc9273025e0a3b734897","pr_number":"183","repository":"git@github.com:yuguangzhi3836-glitch/GO.git"}},"schema_version":"1","signature":"d3dd70a403ef3bb0ae9ec82299b636d59570d8e2da58ba23aa0f0b570d5e726cecaa3ce8d6a0f5634f3aee313d38a6544471a4cc8419a6306663930e6f7b7100","task_id":"go-boss-test-pr-183-b830d1b36e7e"}
