{"action_id":"HK_STAGING_CANARY","authority":"GO-COMMAND-CENTER","environment":"HK-STAGING-01","expires_at":"2026-09-18T01:16:06.302992Z","issued_at":"2026-09-18T01:01:06.302992Z","nonce":"Muf4mBONcvcKOeD5X10W7sq1FO77tZ_d","parameters":{"candidate_contract_sha256":"36622f0648051d57d5918ea4ff7b9ac4e74f9c686e8f2c503f66bda15bd4b120","candidate_image_id":"sha256:633a22a0766e587587eeb324ebb6db78dee321118f996b58803da0d7ac34cbf0","candidate_package_sha256":"bb4f62f6087f368a33cf154d225ed96860c910a98eba9c70c0d7342f73bb8af5","expected_current_image_id":"sha256:6c005a88ec772ac971e560e5f29d0cfa6a8354bb16e0d52d9cbefef0def1dfe1","release_id":"boss-request-canary-20260918T010106Z-4307b6b111b0"},"schema_version":"1","signature":"472e42bab8fd12def1aad532ca3411e4bb2fa5e204c7a8104bb7d1b9f27461db7a64a874bbb3f6ee9adca27785bcfd38553fc3bdf5fa5a9a5b66fc510302d60d","task_id":"go-boss-request-canary-20260918T010106Z-4307b6b111b0"}
