{"action_id":"HK_STAGING_DEPLOY","authority":"GO-COMMAND-CENTER","environment":"HK-STAGING-01","expires_at":"2026-09-18T00:06:56Z","issued_at":"2026-09-18T00:05:53.485660Z","nonce":"Xez3mOKkgTE_F0oPai-5_xxFLYZtgo2z","parameters":{"approval_id":"approval-f79f5bc6740b8108","canary_evidence_id":"boss-request-canary-20260917T235544Z-004f5f793ebf","candidate_contract_sha256":"474dc4edaf3e9e222176d324d8116ae295c381a382ae8545bb82eddb6b7241c5","candidate_image_id":"sha256:6c005a88ec772ac971e560e5f29d0cfa6a8354bb16e0d52d9cbefef0def1dfe1","candidate_package_sha256":"db25ba8cd45f019f65557a075abc7c59762cc7e01dac6f6e0634be1b36f9457b","expected_current_image_id":"sha256:8f8beb568209393fd74660c226ca7b14b2efe171caf5521645ec6fe4cea56119","release_id":"boss-deploy-f88ed5b88c84924a70077b7d"},"schema_version":"1","signature":"9bf1ffeb87a12710a347a676d13dfd95895b37ed0f3149a4a8f47389ba1319d9942f06ad1af4e21554ca5ae0e53c0fc932ffc311af43ed656d0b706620bece0d","task_id":"go-boss-deploy-f88ed5b88c84924a70077b7d"}
