{"action_id":"HK_STAGING_TEST_PR","authority":"GO-COMMAND-CENTER","environment":"HK-STAGING-01","expires_at":"2026-09-17T11:57:12.605392Z","issued_at":"2026-09-17T11:37:12.605392Z","nonce":"sZz4iTNGE6hA9XZDrsgEQYqw1JF-bq-U","parameters":{"builder_profile":"go-application-python-v1","source":{"commit_sha":"edd3500575d2f2b81298cc9273025e0a3b734897","pr_number":"183","repository":"git@github.com:yuguangzhi3836-glitch/GO.git"}},"schema_version":"1","signature":"ccc2737bbf91c12db6f0fd65c3cdb8395043d333d95160a0369c74864665603032bef2f2f86c85f648fb36c3be2f9bd322d81258e9784ad3d25c30e6f05cf304","task_id":"go-boss-test-pr-183-3a7ec32c646d"}
