{"action_id":"HK_STAGING_CANARY","authority":"GO-COMMAND-CENTER","environment":"HK-STAGING-01","expires_at":"2026-09-17T23:21:43.402995Z","issued_at":"2026-09-17T23:06:43.402995Z","nonce":"bT000dHnh9giFpFF0R4olhb9cFSEM5mD","parameters":{"candidate_contract_sha256":"474dc4edaf3e9e222176d324d8116ae295c381a382ae8545bb82eddb6b7241c5","candidate_image_id":"sha256:6c005a88ec772ac971e560e5f29d0cfa6a8354bb16e0d52d9cbefef0def1dfe1","candidate_package_sha256":"db25ba8cd45f019f65557a075abc7c59762cc7e01dac6f6e0634be1b36f9457b","expected_current_image_id":"sha256:8f8beb568209393fd74660c226ca7b14b2efe171caf5521645ec6fe4cea56119","release_id":"boss-request-canary-20260917T230643Z-820bd1dc8322"},"schema_version":"1","signature":"e11e5d52b72ed649bf072701a80bce5a4483033a10dfc9053361ee3f6522cb2225287f3058cc1e11b490541094e5326527f697750a6ea6a467efd4f95f1c9d04","task_id":"go-boss-request-canary-20260917T230643Z-820bd1dc8322"}
