{"action_id":"HK_STAGING_CANARY","authority":"GO-COMMAND-CENTER","environment":"HK-STAGING-01","expires_at":"2026-09-11T04:51:00Z","issued_at":"2026-09-11T02:51:00Z","nonce":"EZOUvmb0gVqEQ8R-YJqfAedXjXr21QHC","parameters":{"candidate_image_id":"sha256:66c540878ff5dd8d2d089059288c3d9f0c45f880514f7b053bd50defb9e8c324","candidate_repo_digest":"go-hotel@sha256:66c540878ff5dd8d2d089059288c3d9f0c45f880514f7b053bd50defb9e8c324","expected_current_image_id":"sha256:66c540878ff5dd8d2d089059288c3d9f0c45f880514f7b053bd50defb9e8c324","release_id":"r31-5-final-canary-20260911T025100Z"},"schema_version":"1","signature":"5ad6306a11242d68bc6edcb1d182c626897e3df8cfa8244f49b5ecd1f26bc6560f56216cbbaa17350e41ab27faa2aa9adbb588d6e399558a4f0dcf0570056c02","task_id":"go-boss02-final-canary-20260911T025100Z"}
