{"action_id":"HK_STAGING_CANARY","authority":"GO-COMMAND-CENTER","environment":"HK-STAGING-01","expires_at":"2026-09-17T14:53:49.390498Z","issued_at":"2026-09-17T14:38:49.390498Z","nonce":"L3LX6CLg7bxYp2leWBFRvHJq9rW8Ygl_","parameters":{"candidate_contract_sha256":"23d78ea846b21ace5318335eacb2a75826db5ff56cd925c8f8c58f6a83babed6","candidate_image_id":"sha256:8f8beb568209393fd74660c226ca7b14b2efe171caf5521645ec6fe4cea56119","candidate_package_sha256":"93f6812337e491d9144d6fb44a52764e9fa82313d2bb08a6373a613e4cdf30bf","expected_current_image_id":"sha256:6b92050ed42c115d29d2ff0b540c711b21747c7ed961384629a35571cf6b93a7","release_id":"boss-request-canary-20260917T143849Z-fe193f16f19c"},"schema_version":"1","signature":"e122db787b40f2984d18185b63db6b0fd3c949b27f3ea2fd593097a3d89cdafbf4d08b5cc9e08f00c242b8bd6368de5102cb83bbc3f333047ce768de9967c80b","task_id":"go-boss-request-canary-20260917T143849Z-fe193f16f19c"}
