{"action_id":"HK_STAGING_VERIFY","authority":"GO-COMMAND-CENTER","environment":"HK-STAGING-01","expires_at":"2026-09-11T12:08:28.832549Z","issued_at":"2026-09-11T11:53:28.832549Z","nonce":"rzuNCNxR2lsGnBxN8zvijeYa53IkhvQS","parameters":{"candidate_image_id":"sha256:66c540878ff5dd8d2d089059288c3d9f0c45f880514f7b053bd50defb9e8c324","expected_current_image_id":"sha256:66c540878ff5dd8d2d089059288c3d9f0c45f880514f7b053bd50defb9e8c324","release_id":"boss-request-verify-20260911T115328Z"},"schema_version":"1","signature":"2b1923b3fb32e488d7da2b77f99479988ba6f6791af06b71cfbbc9a95225135f29b67d12459da398b92688bc16128824b7545fca74690106be455a2274355608","task_id":"go-boss-request-verify-20260911T115328Z"}
